Sheet: StreetBell-Interface
C2: StreetBell-Interface | J2: Berechnete Zellen
B4: [V] | C4: [V] | D4: [A] | E4: [V] | F4: [F] | G4: [F] | H4: [Ω] | I4: [Ω] | J4: [Ω] | K4: [s] | L4: [s] | M4: [Hz]
A5: pos | B5: Uk | C5: Ud | D5: ILED | E5: ULED | F5: C1 | G5: C2 | H5: R1 | I5: R2 | J5: Rg | K5: τ2 | L5: τ3 | M5: fg | N5: Device
A6: 1 | B6: 6.8 | C6: 1.2 | D6: 0.02 | E6: 1.4 | F6: 0.0001 | G6: 0.00001 | H6: 200 | I6: of:=[.J6]-[.H6] -> 9.99999999999997 | J6: of:=([.B6]-[.C6]-[.E6])/[.D6] -> 210 | K6: of:=[.H6]*[.F6] -> 0.02 | L6: of:=[.I6]*[.F6] -> 0.000999999999999997 | M6: of:=1/(2*PI()*[.H6]*[.G6]) -> 79.5774715459477 | N6: PC829
A7: 2 | B7: of:=[.B$6] -> 6.8 | C7: of:=[.C$6] -> 1.2 | D7: of:=[.D6] -> 0.02 | E7: 1.25 | F7: of:=[.F$6] -> 0.0001 | H7: of:=[.H$6] -> 200 | I7: of:=[.J7]-[.H7] -> 17.5 | J7: of:=([.B7]-[.C7]-[.E7])/[.D7] -> 217.5 | K7: of:=[.H7]*[.F7] -> 0.02 | L7: of:=[.I7]*[.F7] -> 0.00175 | M7: of:=1/(2*PI()*[.H7]*[.G7]) ->  | N7: CNY17
A8: 3 | B8: of:=[.B$6] -> 6.8 | C8: of:=[.C$6] -> 1.2 | D8: 0.04 | E8: 1.32 | F8: of:=[.F$6] -> 0.0001 | H8: of:=[.H$6] -> 200 | I8: of:=[.J8]-[.H8] -> -93 | J8: of:=([.B8]-[.C8]-[.E8])/[.D8] -> 107 | K8: of:=[.H8]*[.F8] -> 0.02 | L8: of:=[.I8]*[.F8] -> -0.0093 | M8: of:=1/(2*PI()*[.H8]*[.G8]) ->  | N8: of:=[.N7] -> CNY17
A9: 4 | B9: of:=[.B$6] -> 6.8 | C9: of:=[.C$6] -> 1.2 | D9: of:=[.D8] -> 0.04 | E9: of:=[.E6] -> 1.4 | F9: of:=[.F$6] -> 0.0001 | H9: of:=[.H$6] -> 200 | I9: of:=[.J9]-[.H9] -> -95 | J9: of:=([.B9]-[.C9]-[.E9])/[.D9] -> 105 | K9: of:=[.H9]*[.F9] -> 0.02 | L9: of:=[.I9]*[.F9] -> -0.0095 | M9: of:=1/(2*PI()*[.H9]*[.G9]) ->  | N9: of:=[.N6] -> PC829

Sheet: PC829-test
C2: PC829 – Test | H2: Berechnete Zellen
F3: Uvdd | G3: 3.3 | H3: V
B4: [V] | C4: [A] | D4: [Ω] | F4: U | G4: of:=[.G3]*0.25 -> 0.825 | H4: V
A5: pos | B5: Ue | C5: ILED | D5: RD
A6: 1 | B6: 0.049 | C6: 0.0104 | D6: 200
A7: 2 | B7: 0.034 | C7: 0.02 | D7: 100
A8: 3
A9: 4